评论时间,昵称,评论内容
2020-08-22 21:24:14,苜堇_,有时候会觉得自己真的挺孤独的。无论是亲情友情还是根本称不上爱情的爱情。每次在要去学校住宿的前一天，也许是巧合吧，家人总是很晚回家，通常是我一个人待在空空荡荡的家里一天，我也是第一次离家那么远去读高中，要面对许多不认识的人，还要全力把自己融入陌生环境，顶着巨大的学习压力
2020-08-22 21:16:23,十八子艹匊,mv看了很感动，小时候只看过mv，没看过电视剧，
2020-08-22 01:58:00,Pegasusiks,是积攒了很久的委屈
2020-08-22 01:07:56,我的Ioney是全世界的海,一个人
2020-08-21 01:50:43,爱蹦迪的顾夜黎yu,一个人
2020-08-20 22:33:41,Eclips--森林,天堂走好
2020-08-20 15:35:31,今夜天上没有星星那就请看我眼睛,我一个人吃饭旅行到处走走停停。
2020-08-20 09:18:34,ixc--,一个月的时间，我用20天适应有你的生活，每日神采奕奕，而用接下来10天试着把你剥离我的生活，终日忧心忡忡。
2020-08-20 00:51:23,请问谁不喜欢刘昊然呢,一定会的
2020-08-20 00:17:50,belief刕,谢谢啦，正在慢慢适应…一定会好的吧
2020-08-20 00:07:37,请问谁不喜欢刘昊然呢,抱抱，一定要好好的
2020-08-19 19:08:44,MtX先森,下午，很困，睡了，，，醒了，天黑了，身边没有一个人。
2020-08-19 07:27:20,honeyseaar,歌 他叫叶子歌
2020-08-19 02:02:01,yeehwoo,祝好
2020-08-18 23:15:05,易拉罐卩,爱情 原来的开始是陪伴
2020-08-18 20:46:11,白泽浩_yOCX,我不允许看到这条评论的人接下来的日子还是单身！[多多耍酷][多多耍酷][多多耍酷]
2020-08-18 19:40:56,_眉间意难了,叶子
2020-08-18 10:35:25,belief刕,这是我男朋友最喜欢听的歌
2020-08-18 10:34:54,belief刕,分手啦，三年的感情就这样结束啦，尽管有很多不甘心跟遗憾。我真的好爱他，可是就是这样结束啦，这些天哭了很久。我不再哭啦，是因为我把眼泪流汗了哭不出来了。我要学会成熟点了，不再期待爱情了。我只想好好照顾自己，保护自己。也不会期待遇到别人啦，因为生命中不会有第二个他啦
2020-08-18 07:41:40,我喜欢空气里的烟火味,得是多孤独失落的人才能写出这样的歌
2020-08-18 04:26:03,粘粘想睡觉,嗯
2020-08-17 22:51:35,欲望本该像野马可我只想要你_MFX,感谢云村让我知道了这首宝藏歌曲[爱心]
2020-08-17 21:48:28,窒氧1,你好可爱
2020-08-17 21:47:32,窒氧1,没意思
2020-08-17 02:18:03,再见我的热爱,现实狠狠地打了我几巴掌
2020-08-17 02:17:26,在你离开之前请叫醒我,好想你 我的小可爱酱酱
2020-08-17 00:21:00,t-swish,哪里可以看到？
2020-08-17 00:20:06,t-swish,不再让你孤单
2020-08-16 20:16:04,阿帆Evan,去的人注定做好备胎的准备。
2020-08-16 19:11:27,雨潇晓,是说女孩子嫁了人吧，也不算娘家人，也不算婆家人。
2020-08-16 12:28:19,Enter终_,一个人一直一个人[大哭][大哭]
2020-08-16 12:18:46,寒鸡子烧次鼓,方法吗
2020-08-15 20:49:18,Innocent-ly,心理医生不太专业
2020-08-15 20:48:36,肖先生时尚音乐,来看你了阿桑[幽灵]
2020-08-15 17:52:19,我喜欢空气里的烟火味,我不怕孤独，但怕一直孤独
2020-08-15 10:52:26,桥段太烂,只是心又飘到了哪里 就连自己看也看不清
2020-08-14 23:20:32,gus禾,懂事真的是很难受的一件事
2020-08-14 19:58:57,FantasticBec-,原来那个狗子表情包配的文字是从这儿来的啊……
2020-08-14 08:07:55,仙女的镜子,百度云需要吗hhh
2020-08-14 08:07:38,仙女的镜子,海角七号也好康
2020-08-14 02:42:39,欣怡臉好肥,其实我好想小崔
2020-08-14 00:53:06,吴三热,我知道我喜欢
2020-08-13 23:17:15,15-9,我真的好喜欢你啊，为什么你就是不喜欢我呢？李先生，可不可以稍微珍惜我一下。
2020-08-13 22:19:24,糖果小屋Tw,从大学不行吗？
2020-08-13 17:53:27,每天爱你多一,陈晓娟[强]
2020-08-13 00:57:02,小地瓜的破烂摊,都会过去哦
2020-08-13 00:31:15,jesse丶鑫,一定要幸福啊
2020-08-13 00:15:54,音音r,一样[多多难过]
2020-08-12 20:34:47,茶卡拉澈,17岁的叶子🍃
2020-08-12 18:30:23,不知道叫什么o1,$~%~~~~
2020-08-12 15:58:10,那就再見叭-,记得那时候很喜欢阿桑....
2020-08-11 22:52:01,上楼梯_-,生活本来就是丰富多彩且浪漫，只是我们太厉害了，有本领让它变得普普通通平平无奇哈哈哈哈哈
2020-08-11 19:43:26,Lawaken,终于理解了歌词
2020-08-11 10:46:44,卡殿926,路还在自己也在[发怒]
2020-08-11 00:45:01,言行1致,真的好巧啊  还有专门薛之谦的歌单   总觉得就是他...  是我又胡思乱想了
2020-08-11 00:42:41,言行1致,你和他用一样的头像  你的名字也碰巧有我的含义.  你发这条评论的时间我们分手一小段时间   可能真是巧合吧   晚安
2020-08-10 18:30:04,凹凸cassia,谢谢，你也加油
2020-08-10 17:38:13,云深曾知处,同城woc
2020-08-10 06:08:57,你看万家灯火阑珊处,两个声音都熟，不觉得像[大哭][大哭]
2020-08-10 02:53:29,hao-jian,葉子再次飄向的地方，一定是奇幻而美好的。 
2020-08-10 02:51:43,hao-jian,葉子的曲調有著强烈的共鳴，仿佛是一個人的最初與最終。曾經很長一段時間裏，我的人生似乎蒙上了一層灰沙。能真真切切陪著我的。也只有阿桑的嗓音。聽的出來，我們一定有著相同而不幸的經歷。天堂是怎樣的，我不知道。只祈願天堂沒有苦痛。葉子再次飄向的地方，一定是奇幻而美好的。
2020-08-10 02:42:00,hao-jian,《葉子》的曲調有著强烈的共鳴，仿佛是一個人的最初與最終。曾經很長一段時間裏，我的人生似乎蒙上了一層灰沙。能真真切切陪著我的。也只有阿桑的嗓音。聽的出來，我們一定有著相同而不幸的經歷。天堂是怎樣的，我不知道。只祈願天堂沒有苦痛。葉子再次飄向的地方，一定是奇幻而美好的。
2020-08-10 00:18:03,影子与我啊,太孤独啦 卧槽
2020-08-09 23:46:09,Biu的Good,没人为蔷薇之恋来嘛  
2020-08-09 18:01:42,延时必,我想去看西府海棠
2020-08-09 16:49:24,你在我心里又何止好几年_,想回去看外婆 想吃妈妈做的菜
2020-08-09 11:34:21,水星记XY,不知原谅什么，诚觉世事尽可原谅
2020-08-09 07:11:53,韩冬雨H,你看我怎么样，考虑一下我吧[西西机智][西西机智]
2020-08-09 01:13:56,每天都想自然醒owo,结束了
2020-08-08 21:30:23,排骨米饭啦,我一个人。
2020-08-08 18:32:50,霍去病的小脑残粉,举报不谢
2020-08-08 18:31:30,霍去病的小脑残粉,葵才是最适合百合的人，可惜血缘是一种那么暴力的关系。
2020-08-08 15:16:32,请叫我赖小姐,依旧一个人😌
2020-08-08 12:46:47,歌本洞悉,谢谢阿桑
2020-08-08 10:20:28,风儿甚是喧闹,我以前谈过的一个女孩，分手后非常恨我，都七年了还是不想见我，女人的恨和男人的愧疚真的会维持很久很久
2020-08-08 10:18:10,韩冬雨H,又是一年了，现在可好，还是一个人吗
2020-08-07 20:57:04,akksmnxjakmxhdhjdj,怎么抱抱啊
2020-08-07 20:13:49,poisedla,原谅我这才知道原唱是谁，我之前一直以为是田馥甄
2020-08-07 16:02:21,啊东nan,这个旋律好像在别的歌里听到过
2020-08-07 07:17:37,不落18277,昨天失恋了，心情很差。晚上11:30打电话给前男友，一找到人倾诉，我就忍不住落泪哭泣，他问我在那里，我告诉他地址后，他叫我在那里等他。挂掉电话后，我深吸一口气，迈开快乐的步伐回了家。
2020-08-07 03:45:14,丁昱淇,五年，你好
2020-08-07 03:30:16,白荻音,这是我唯一的衷心祝愿，是我的愿望。她说，我送她的娃娃，在她的床头，这样也好。
2020-08-07 03:28:12,白荻音,我也想过，也许她变了，我也变了，但我想着，总有一些是没有变的，我希望通过那些不变的创造出新的变化，属于我们的美好变化，可惜，它变了，可惜，也很后悔，想想以后没有机会弥补过去，也没有机会参与她的未来。我在心里和自己说过，撞了南墙再回头吧，现在撞到了，还是想说，我会祝她身体健康，这是
2020-08-07 03:19:26,白荻音,前几天我见她，送给她一个娃娃，那个娃娃是我当时玩娃娃机夹到的，唯一一次夹到的，也是我当时承诺送给她的，终于给了她，走的时候朋友跟我聊天，说了一句，我感觉你很喜欢她啊，我没有回答，但心里是很高兴的，真的很高兴，因为我以为，总算要重新开始了，不想再犯过去的错了，不想再错了
2020-08-07 03:10:23,白荻音,的早恋吧，是啊，这是两个小孩没有物质要求的恋爱，是你们认为人生早期的无疾而终的懵懂爱恋的终曲，可是，我现在只有十六岁，那三年，是我人生的十六分之三，是仅有的五又三分之一个三年中的一，是我无论活多久都不能忘怀的过去
2020-08-07 03:02:07,白荻音,黑暗的压抑的生活，是啊也许那段日子不是人生中最艰苦的，却是我最难忘的，那时的我只有她的鼓励和关心，其他什么都不剩了，那时的我，想要的是能力，能陪着她的能力，我要考到好的学校，这样就能好好陪伴她三年，再考到她所在城市的大学，陪她人生的余年，天真吧，可笑吧，这在你们看来是一场内心波涛
2020-08-07 02:55:05,白荻音,在下雨天说一句话，下雨了，它是我世界里的月色真美，是我能讲给她的最浓的情话，想想过去，我也只说这些，真是遗憾。后来她不在本地上学，虽然我们之前也不常见面，那时却也成了真正的异地，她分享学校的风景和故事给我，我分享不了什么给她，那时我初三，她比我大一岁，那年的我过着很少交流很少放松
2020-08-07 02:44:49,白荻音,但我都没有接受，问我自己为什么，真的不知道是为什么，可是啊，我喜欢上了她，因为一些普通的不能再普通的事情相遇，联结，在别人眼里我是一个文静的像女生一样的男生，是一个高冷的爱看书的男生，我想，在她眼里我不是这样的，我的缺点她知道，拙劣的行为她看得见，但她知道这是我，后来我总喜欢
2020-08-07 02:35:16,白荻音,前几天我朋友陪着我见了她，我们认识三年，见面却不过数次，从最初的美好到破碎的关系和距离，我和她的经历都是我人生仅有一次的，听到她的名字会心痛，看到她的照片会心暖，她的容颜不是我认为最好看的，不是惊艳的，我遇到过让我一见钟情的女孩，遇到过喜欢我愿意在众人面前对我表白，找各种理由接近
2020-08-06 21:30:16,忙碌了一天的林师傅,“删好友是小孩子才干的事，成年人都是互不打扰。”
2020-08-06 08:18:19,Innovator20170128,不好意思 第一眼看成了叶问
2020-08-05 21:36:44,我爱你用英文怎么讲,坐标益阳南县，90年，身高173cm，性格温和，稳中带皮，不抽烟，不喝酒，爱看喜剧电影，打篮球，蹲一个三观合，温暖踏实的同城妹坨，牵手走向婚姻。
2020-08-05 06:02:16,晓东诶,淋了一整夜的雨.......
2020-08-04 23:59:42,是你的沈漂亮呀,怎么办呐 太容易感性了 太容易陷进去了 我不能这样子啊啊啊希望少一些聊天吧 网恋不现实 不能陷进去
2020-08-04 23:15:00,琬若星河,爱情，原来的开始是陪伴。
2020-08-04 22:15:26,Z1Z_Z1Z,[亲亲]
2020-08-04 20:41:28,喜_碧,叶子是我第一首能把歌词背下来的歌
2020-08-04 19:27:03,叫我琼琼啊,一个人
2020-08-04 18:30:34,你在我心里又何止好几年_,我一个人吃饭坐车到处走走停停，也一个人发呆静坐跟自己说话谈心，太累了，今天在沙县小吃吃炒粉的时候突然听到这首歌，突然间就泪崩了，一个人的生活太难了太累了
2020-08-03 21:47:29,Littlestar_jyz,异地恋过得比自己一个人还糟糕毕竟我自己一个人的时候起码没有期待
2020-08-03 16:58:17,生不了人抱歉skr,i考就哦欧u偶偶
2020-08-03 16:57:55,生不了人抱歉skr,kjjkkkjjmmmmmmmmmmmmmmmmmmmmmmmmmmmmmmmmmmmmmlmmjlumkmjlmlj
2020-08-03 00:06:46,Clownswhl,到点了哥哥姐姐们，打开网抑云了，呜呜呜呜[流泪][流泪][流泪]
2020-08-02 05:45:01,yang_sike,好
2020-08-02 02:10:16,昵称被挪用了,阿桑真是一个宝藏歌手 没有去世的话 估计有更多优秀的经典歌曲
2020-08-02 00:43:13,可我不是卡坦精,"9年前，初恋女友的Q名叫叶子，那时候真的很喜欢她。分开后还是很久不能释怀。那时候学校选拔唱歌的同学，我上台前给她拨通了电话没有挂，然后冲上台唱了这首歌。等我唱完下来，电话早就挂断了。后来她说，因为太吵了，她根本不想听，刚接通的时候就挂了。"
2020-08-01 21:32:52,葫芦岛昊彦祖,是啊，我好累
2020-08-01 10:58:00,假装不在乎心,这音色，有点像张靓颖诶
2020-08-01 01:27:16,是王宇琦吖,爱情 十有九悲 别羡慕
2020-07-31 21:51:38,嘎嘎宝宝a,我一个人吃饭坐车到处走走停停也一个人发呆静坐跟自己说话谈心只是心啊又飘到了哪里就连自己也看不清自己我想，我不仅仅是心理有问题
2020-07-31 21:43:47,嘎嘎宝宝a,我一个人吃饭坐车到处走走停停也一个人发呆傻笑跟自己说话谈心只是心啊又飘到了哪里就连自己也看不清自己我想，我不仅仅是心理有问题
2020-07-31 04:11:19,詹岚丶,网易云音乐让我有了可以分享心情的地方
2020-07-31 03:29:05,每天爱你多一,但我也渐渐遗忘，当初是怎样有人陪伴
2020-07-30 23:02:20,那个懵予,对啊唉
2020-07-30 23:01:08,方知井,害怕也会变成习惯。
2020-07-30 20:11:15,Meggie小华子,👊加油
2020-07-30 13:41:33,你笑里有清风_,emmmm抱抱
2020-07-30 10:09:41,瑟瑟ye,我想我不仅仅是失去你……
2020-07-30 09:12:13,逍遥小饼,羡慕走到最后的。7年以后分手真的要了我的命
2020-07-30 01:01:02,洛恒归故里,小叶
2020-07-29 22:34:14,暗暗暗涌,谈第一个男朋友的时候，他帮我弄QQ空间，背景音乐是这首歌。一直到现在，都还是这首歌。十年了，三个人。十年了，没有结果。
2020-07-29 20:16:55,在人间凑数的日子Mate,我还能正常多久还能学着开朗多久还能学着无畏多久还能…嘿嘿😁，加油(ง •̀_•́)ง多久
2020-07-29 19:39:15,种那萌很萌很子妹要想我,[大哭]
2020-07-29 18:38:13,偏爱子,I can be your friend!
2020-07-29 18:37:28,偏爱子,[可爱][可爱][大笑]不哭哦，总有一天，两天孤单的鲸鱼会相遇的
2020-07-29 12:14:45,我在向往什么,其实根本没什么
2020-07-29 11:12:36,狗狗不在家,我一直都没看见太阳
2020-07-29 02:50:55,lkari,时间真快 马上我们就是分开半年了 可是我还在觉得是昨天你牵着我的手
2020-07-28 22:11:45,Elaina_R,😭是啊，当我妈跟我说“嫁妆妈妈没能力为你准备了，你就自己挣”的时候，我的心好难受
2020-07-28 19:18:17,千颂伊i,有时候我觉得，其实我去做一件事，它并不需要是对未来的生活有意义的，只要它对我有意义就好
2020-07-28 16:16:31,沉积已久的心情,让连朋友都没有的我体验一次恋爱吧，一次就好
2020-07-28 10:16:05,三凡先生,😆[呆]😈
2020-07-27 23:55:52,请问剧组还缺人吗,[呲牙][呲牙][呲牙]1180分钟
2020-07-27 23:49:29,浪子就别泊岸,阿桑随风相消去 尘世在无寂寞曲
2020-07-27 20:34:36,Mineforever,两个人什么都好 一个人也没什么不好 怎么急得来
2020-07-27 18:20:05,仙女在吃柚子,故事就到这了
2020-07-27 11:07:26,我的小逗昵称被谁注册了,俗[大哭]
2020-07-27 11:07:01,心遇暖阳丶,陪你笑笑  哈哈哈哈哈
2020-07-26 14:11:06,记忆I时光,拿你记得阿桑吗
2020-07-26 13:06:52,叫爸爸MY,我一个人走走停停
2020-07-26 12:26:53,脱轨少女,一定一定要加油！
2020-07-26 11:48:33,厉劲豪,叶嘉欣啊，我真的有点喜欢你呢，可你不喜欢我吧。
2020-07-25 23:46:27,浪子就别泊岸,还有人记得那个爱笑坚强的女孩 姚贝娜吗
2020-07-25 22:14:17,是三岁12呀,抱抱
2020-07-25 22:08:40,毛庄村的老毛,我身边在搂着儿子睡觉的美女就是高中同学。
2020-07-25 18:40:32,那个懵予,真害怕习惯孤单
2020-07-25 01:22:24,叫我婷婷叭,你永远都不会理解我对你的依赖
2020-07-25 00:37:27,marmws,读书时是这样想得，可转眼已到而立之年。
2020-07-25 00:18:47,weary本人,“你有没有被世界抛弃却又舍不得这个世界的时候”
2020-07-24 11:48:31,被打成筛子,刚进大学的时候，觉得自己很孤单，总爱听这首歌。如今都毕业八年了，也有了属于自己的家，再听到这首歌的时候，除了年代感之外，仿佛空无一物。
2020-07-24 03:17:08,小猪数月亮,夜晚使我丧失了理性 差点被冲昏头脑说想你了
2020-07-24 00:23:33,良宵1807,可能是我们没缘分
2020-07-23 23:38:41,你是救赎y,心情失落的时候连一个真心交谈的朋友都没有了
2020-07-23 21:58:25,大寒夜山那头彤云出岫,应该是初中的时候一个关系比较好的同学推荐的吧，今天逛街突然听到了，然后找回来了。我也大学了，同学也不再联系了。
2020-07-23 17:42:54,Gerning, Good~
2020-07-23 13:52:43,NeGup_,刚看到这条评论！好的！这就去
2020-07-23 13:27:30,为实现中华民族伟大复兴而听歌-,杨文娟，爱你就是一辈子而已，下辈子你也想要吗[呆]
2020-07-23 03:34:04,叶梓Risei,叶子…叶子。
2020-07-22 23:34:50,林语惊_5fmO,翻开日记本你还在现在他不是每天让我提心吊胆等的那一个了     是每天晚上回到桌前那本书里的主人公是家啊
2020-07-22 23:32:27,mr-lxins,他的说笑 你却当真了
2020-07-22 20:02:41,11sxz,真的管好你自己[拜]
2020-07-22 20:01:07,11sxz,网易上等人现在还指导人发评论了 以后是不是还得出台一个发评论的几点要求呀？有些人这逻辑 直肠直通大脑吧？
2020-07-22 19:57:33,11sxz,你不需要鸡汤你需要一巴掌
2020-07-22 19:56:51,11sxz,啊这啥都能被你说成网抑云？网抑云梗你懂吗[西西疑问] 伤人不自知 可能你家庭幸福美满人家不是这样呀所以在你眼中所有人都是开心幸福的咯？一概而论的不是我是你对号入座也挺可怜的
2020-07-22 13:12:48,snonlyyour,有些歌听着听着就哭了，有的歌再听就突然懂了
2020-07-22 12:54:07,玏玏叻,网易云评论的女生各种人间不值得，没有好男人，然后有个好的男孩又心疼她懂她的，然后不好意思，我们不合适[大哭]
2020-07-22 01:55:40,BOBO流年,一直以来我都算懂事的，因为我知道他很爱我，我也知道自己一定会提分手。只是没想到，在我第一次难过任性闹脾气的时候被彻底分手了，还闹得好难看。可能之前都是假的吧，也许我连歉疚也不必了。
2020-07-22 01:36:50,BOBO流年,几天前忍不住哭着循环了一路，那个时候的我，想他。知道解脱了，知道没有谁被谁无条件关心了，知道再遇不到这么喜欢我的人了。但我真的好累，累到没有办法照顾好自己，更没有办法兼顾他，却在我放他走时被闹到两看相厌。我意难平，我爱的人，恨我了，我却没办法恨他，但歉疚却被磨灭了。愿再也不见。
2020-07-22 00:22:33,毛不休,你这情商…
2020-07-21 22:58:08,三月酒z,祖安在扫黄？
2020-07-21 22:56:49,三月酒z,老网抑☁️了，我只能说你爸妈不爱你吧，我姐回老家工作，我爸妈直接gei买房子，不要一概而论，大概率是网上毒鸡汤看多了
2020-07-21 18:49:45,红烧雪花膏,抱抱每个人都是世上最好的人，爱你呀[爱心]
2020-07-21 16:55:18,_穎wing,大概有6年不敢听的歌.....现在听已经释怀了.....
2020-07-21 14:18:36,hakuna6661,求书名
2020-07-21 08:08:00,胖胖Tyh,你为她倾尽所有，最后你却一无所有。
2020-07-21 01:32:30,乙戌君_ktt,不被爱是常态，你得接受
2020-07-21 00:58:49,koncarl,🙁
2020-07-20 23:30:30,柴家郡,意外的有点温柔
2020-07-20 16:06:14,Era_K,[皱眉]
2020-07-20 07:58:35,我想做樂師,现实呢？最好的只能是不负遇见，此后不复相见
2020-07-19 23:40:54,junjun31,是个狼人😂😂
2020-07-19 07:59:49,子小丸同学,再一次痛哭，把枕头都打湿；我失去了你，变得堕落；多么想回到那一刻，紧紧拥抱你，没想到那一瞬间就变为永别，我甚至不知道你葬在何处，我也没有理由祭拜你，多么奇怪啊；我一个人生活，没有人可以依靠，每次被生活暴击的时候总是怀念你给的温暖；我如一朵假向日葵，可是假装向日的时候我真的很累
2020-07-19 01:41:15,云卷云舒1023,这种渴望不可及，大多数人的心里都装着那么一个人，得不到的在骚动，被偏爱的有恃无恐
2020-07-18 23:03:50,高砹酸钫_Fr5AtO6,我希望看到的女孩子都能组建一个幸福完满的家庭。
2020-07-18 23:02:42,大野同学涅,@高砹酸钫_Fr5AtO6
2020-07-18 21:49:32,可乐煲姜YY,孤单是一个人的狂欢，想享受孤单的同时害怕孤独……
2020-07-18 12:18:44,青瓦台中文在寅,原来我初中看到的文字都是出自这里[呆]
2020-07-18 05:52:23,怪兽223333333333333,终于，又回到一个人生活了  祝你一切安好
2020-07-18 00:39:11,LinPrettyGirl,这 我看非正式会谈听到大左唱这个 就来听听看
2020-07-18 00:21:36,我不怕等待我怕你不来,原来真的心会痛啊。。。
2020-07-17 19:06:26,逃亡孤单星球,抱抱
2020-07-17 14:51:38,烦躁李同学,思祺啊 今天跟朋友提起你来了 说着说着眼眶就红了 好像我不仅仅是失去你 还失去了我自己
2020-07-17 12:16:35,木迪莫,一个人形单影只久了，别人也觉得你好像不需要别人的陪伴。
2020-07-17 03:06:27,筻蠭_,很适合独处或者坐车听的歌   会想起一些往事
2020-07-17 01:11:16,十二月祭,抱抱你
2020-07-17 00:53:36,十二月祭,愿你在天堂时幸福快乐。
2020-07-16 22:40:58,海角七号180117,这部剧因为素材的原因没有在大陆播过，很多人不知道。只是在港台日很火。
2020-07-16 15:32:55,CHENXIYI_041011,我习惯不了一个人 我开始堕落了 我好累
2020-07-16 13:38:20,小地瓜的破烂摊,我已经很久没有因为疼掉眼泪了 可是最近每次掉眼泪都疼到心底
2020-07-16 13:08:39,饱食而遨游泛若不系之舟,加油，相信明天会更好
2020-07-16 03:17:15,思凯你好,她会有危险吗？这也能睡着
2020-07-15 21:31:32,箜白是空白,曾经买过一只写着叶字的项链，只是它现在躺在抽屉里
2020-07-15 20:57:10,酹永殇,听来听去，还是你最动人
2020-07-15 18:22:59,whasupdude,好多年啦
2020-07-15 15:02:50,Carolinaaa000,射手座？
2020-07-15 01:09:27,是一只小白龙,但是想想 很多人都是这样 郁冬什么的
2020-07-15 01:08:49,是一只小白龙,阿桑真的是我觉得很可惜的一个歌手
2020-07-14 20:43:41,北川xrs,我睡醒了会找你  忙完了会告诉你  爱是宠溺  是偏爱  是首选  是例外  是独特  是唯一  这些都属于你  一直都是.
2020-07-14 19:25:24,种那萌很萌很子妹要想我,[大哭][大哭][大哭]乱凑凑出来的。
2020-07-14 19:24:54,种那萌很萌很子妹要想我,哦。[大哭]
2020-07-14 18:30:38,11sxz,你的脑袋真神奇 摇摇就有海的声音^ ^
2020-07-14 17:21:53,Jacksonstarry,vccc出差呢
2020-07-14 16:50:16,我在诅咒你没错,没想到发抑郁 评论区会给我 你们都在 网易云好高级 我喜欢
2020-07-14 16:49:01,我在诅咒你没错,好抑郁的评论区 大家开心点
2020-07-14 16:48:28,我在诅咒你没错,发现了
2020-07-14 12:50:03,本人已不存在d,加油加油加油啊
2020-07-14 03:35:49,Echo-四九,什么关系都是越简单越好，别太执着认真
2020-07-14 00:54:14,小小舒辰,我身上就有一股淡淡的淳香味。好多女孩都说我身上有股很舒服的香味。我都笑笑说，那是渣男的味道。可惜专一到现在还是单着…[哀伤]
2020-07-14 00:07:17,下课一起吃蛋饼吗,我和你一样 但请一起加油
2020-07-14 00:03:39,是你啊是你就是你,愿你无论在哪里都不再会有病痛，平安健康幸福快乐[爱心][爱心]
2020-07-13 23:59:21,是你啊是你就是你,抱抱你，摸摸头，[爱心][爱心][爱心]
2020-07-13 23:56:36,是你啊是你就是你,[爱心][爱心][爱心]
2020-07-13 23:10:00,再不睡就他娘的饿了喔,李晓欣，我又双叒叕想你了，认识两年多来，我好像9成9的时刻都是在“想”你吧。。。想你的声音想你的微笑想你的眼睛想你的青丝想你的一切的一切！想你在做什么想你有没有淋雨想你吃的什么想你的猫miko！是的，也许这一辈子我都不能如愿让你成为我老婆让我成为你愿意去依靠的有力臂膀，但是我还是爱你！
2020-07-13 22:45:56,uinnnnnnn,同感，所以女孩子更要努力，自己给自己一个家
2020-07-13 22:42:21,卑微--爱情,太善良也并不是一件好事
2020-07-13 17:40:30,听歌的时候爱发呆,感到孤单从不是因为自己是一个人，而是又回到了一个人……
