评论时间,昵称,评论内容
2020-10-14 16:40:45,流浪云间的画家,老妈喜欢的歌手，小学每次她开车都会放阿桑的歌碟，后来也开始喜欢这种温柔的调调，有时候和朋友一起去KTV也会唱阿桑的歌，虽然男孩子唱好像不那么好听，但是那种温柔的回忆和声音让现在的我依然感到温柔。
2020-10-13 23:01:11,俊栀天,2020.10.13。。。。。。。。。  来过
2020-10-13 21:31:13,別哭Wen,“你见过羡慕别人妈妈的目光吗”
2020-10-13 19:44:33,sevenyang0125,我感觉我好像是生病了，明明有一群人，还是感觉很孤单
2020-10-13 01:18:38,11sxz,老和尚看剑吧
2020-10-12 15:52:11,四季倘若你都在,曾经互相真的深爱过，只是后来又不爱了
2020-10-12 12:21:16,凡塵諾仙,孤单并不可怕，可怕的是人心
2020-10-11 23:17:47,不管怎样请别忘了开心_,我真的有很认真很用力的喜欢你.
2020-10-11 20:07:30,盘尼吸林,爷青回
2020-10-11 14:50:35,呸呸呸里西奇,顶！说得好，看到你这么反驳她我就不说了
2020-10-11 13:48:05,用户3861577624,哪有那么多初恋到终点的。。。只是大家都向往着纯情罗曼史。。。
2020-10-11 03:04:57,白衣未冷,一个人旅行 也就那样 就怕突然被触碰了什么 就没心情了
2020-10-11 03:00:18,白衣未冷,哭吧 我出来旅游 在火车上半夜睡不着听歌听得想哭 我不想去玩了 我只想回家找个夜市 大醉一场。女孩不要学 你们可以买酒买菜在家把自己灌醉
2020-10-11 01:45:43,你别皱眉丶ZYH,一起都会好的，相信我
2020-10-10 21:43:41,拾柒的日記,阿桑，是我读书时期最爱的歌手之一。她的音乐充满了故事。懂的人自然听着听着就哭了，哭着哭着就笑了。
2020-10-10 12:59:24,萧九琳,我TM要笑死了，叶子，我们班的一个女生，这首歌是从我班主任的歌单里找到的[大哭][大哭]
2020-10-09 22:49:41,iiiakali,你可知道我每次见到你的喜悦都被你的冷言冷语一点点蚕食掉
2020-10-09 21:44:12,刘白冬天要去北方,刷了好久终于刷到《可惜不是你》
2020-10-09 00:43:23,你的淼O,不明白  不懂  不想理解  不知道
2020-10-08 23:18:43,维他命ZJ,其实友情也很脆弱。一句话就刺激到了我，你也有新的玩伴，希望比我更好吧。我累了，不是不想去维系，而是感觉有点累了，回不去了
2020-10-08 22:33:54,佳佳--123,正在经历着三十多年来最大的坎，我熬不过去了。阿桑，我想去陪你…
2020-10-08 20:50:49,一木二土三个金,你知道的你回头我就在你身后。所有坏脾气都改。可你别不要我好吗！
2020-10-08 02:16:18,yunki酱酱,失去的不仅仅是你 更是那个最好的自己
2020-10-08 02:15:50,yunki酱酱,失去的不仅仅是你
2020-10-07 11:37:23,枫雪-孟,"我想保持善良，不愿意相信丑陋是本性，好想抚慰每个温柔、受伤的心。我也想和好朋友旅行，一起玩乐，甩开悲伤。本不愿意独自留恋于忧伤。"
2020-10-07 11:00:19,叁月_325,岁岁平安 生生不见
2020-10-06 21:54:31,沉默寡言191008,希望以后科技可以把她复制出来再给大家唱歌
2020-10-06 00:56:47,夢娜不在_,我们没有分手没有吵架 就只是没法见到面没法聊天没法抱抱他 我很想很想他 我要是能够懂事一点应该就不会这样了吧 我很想很想你 你快点回来好吗 我求求了 谁都可以 只要让他回到我身边就好了 拜托了 让他回来吧好吗
2020-10-05 09:30:22,和头像一样的美女,加
2020-10-04 19:29:17,愤怒的露露酱,太有体会了，尤其离异家庭 ，虽然跟后妈还有话说，可是面上跟里面是不一样的 我爸是个闷葫芦我三十岁了都不知道跟他说什么说什么，哎
2020-10-04 19:07:22,呼吸急促是不是就是缺氧,抱抱~
2020-10-04 15:36:16,梦回灬小時候,我能陪你两个人听歌吃饭旅行吗？
2020-10-04 10:10:08,七月叫我高美美,在宿舍放了这首歌，班长说这是她高中最爱的一首歌，那时候不懂歌中的歌词，现在她懂了
2020-10-04 10:00:55,将离时以遗江蓠,“有我在，不会让你孤单的。”“你都已经孤单那么久了，你还有啥好孤单的啊。”
2020-10-04 06:51:50,我丿q,就差一点......哈哈哈哈哈哈
2020-10-03 22:26:48,陪伴是最长情的告白_dSfM,我喜欢的人也叫叶子
2020-10-03 10:41:41,永远在我身边_0,在火车上突然听到了这首歌那时候身边就我一个人，反正就挺感受相同的。小时候最怕一个人现在已经无所畏惧了
2020-10-02 22:17:45,11sxz,每个人都有不同的情况经历啊
2020-10-02 11:23:27,寒山夜度,听歌。沉迷孤单。享受孤单。[可爱][可爱]
2020-10-02 01:27:19,阿肖h,但是青春为什么tm的要有遗憾啊
2020-10-01 22:51:39,hy嘀哩嘀哩,依旧的关注一人，依旧的头像。
2020-10-01 09:48:15,Zz大壳,抱抱
2020-10-01 07:51:39,小胖妞下雨不打伞,一个人吃饭旅行🎵到处走走停停……          「叶子」漫无目的的走在街上、终于能歌词的意境
2020-10-01 03:34:53,方方是狮子座你呢,我觉得不会阿 永远都是我的家 没那么多其他的东西 
2020-09-29 20:42:57,妮可云和山,欢沁，不是欢泌……
2020-09-29 17:33:33,Farewell卡西莫多的礼物,我看你这句话忍不住泪奔了，，，Mr我陪你十年了，你明明就，为什么还是走了
2020-09-29 15:56:46,NovemberSad,没事 我一天能走出来[大哭]
2020-09-28 22:56:45,我大概已经,RIP
2020-09-28 17:33:15,Tutu0103,但是这种，一旦一方出现问题，就真的很伤，很难走出来，不要问我为什么知道
2020-09-28 13:29:56,老火腿酱,这首歌是不是突然跳了一段。。。
2020-09-28 02:21:58,帐号已注销,我真的很困 很累 但是我处在深深的自责中 我睡不着
2020-09-28 00:09:49,可温kewen,抱抱
2020-09-27 21:54:54,夏天在七月,接下来的日子啊，可能仍然是一个人，仍然充满了未知，仍然遥远又陌生，但我们依然勇敢前往，前往展开这场属于自己的，一人历险记
2020-09-27 19:59:46,沐713,清淡到了骨子里，听着就会觉得静
2020-09-27 10:34:25,Tina浥尘,不知道有人看过《狼的诱惑》的吗？葵很像里面的弟弟，爱自己的亲姐姐是多么绝望的事情啊！好希望这一切只是一个梦，醒来他发现自己其实已经和百合结婚了，一切只是个苦闷的梦罢了，可惜对葵来说是他残酷的现实！
2020-09-27 08:01:22,且爱且珍重,我目前就是，20岁认识的初恋，现在29了，结婚2年有个2岁的宝宝，感情很好，可是我为什么会羡慕谈过很多次恋爱的人呢
2020-09-27 00:51:09,小葱花儿yee,第二次和佐科一起听歌
2020-09-26 20:59:44,4toz,阿桑永远没走
2020-09-26 19:33:31,昊然的李半仙,“突然想到前几天看到的一句话：7岁到17岁全是期待；而17岁到27岁满是心酸，皆是遗憾！！”27岁后只是活着
2020-09-26 11:51:19,一个有沧桑故事的小男人,天堂应该不是妄想，听到这我哭了。。。。
2020-09-26 11:29:54,__三葉__,哈哈哈
2020-09-26 11:27:56,阿诺河,看到家鸽！
2020-09-26 11:23:14,阿诺河,我一个人旅行过啦，一个人去看山川真的很棒，但是一个人去城市会有些孤独
2020-09-26 11:23:10,某某-绕梁余音,可是我，也许一辈子都不可能对喜欢的那个女孩说：“我喜欢你。”因为，我们同是女孩。上天明明这么眷顾我，独独将我生错了性别。
2020-09-26 11:21:15,阿诺河,太真实了
2020-09-26 11:21:06,阿诺河,一个人太久了，好像也习惯了
2020-09-26 10:44:11,某某-绕梁余音,可是我，也许一辈子都不可能对喜欢的那个女孩说：“我喜欢你。”因为，我们同是女孩。上天明明这么眷顾我，独独将我生错了性别。
2020-09-25 22:12:00,歌神张1学友,03
2020-09-25 20:16:05,古月方秋,脑瘫
2020-09-25 15:52:57,黑泽志玲老师,可是我改不了
2020-09-25 13:28:38,树皮她同桌,有一种寂寞，身边添一个可谈的人，一条知心的狗，或许就可以消减。有一种寂寞，茫茫天地之间“余舟一芥”的无边无际无着落，人只能各自孤独面对，素颜修行
2020-09-25 01:17:50,-如痴-如醉-,好像有点道理
2020-09-24 15:50:06,慵懒的午后_Bella,说的太对了，我就是那种敏感的人，这种人活着真的挺累的，别人随便一句话让你不高兴，但别人也没有那么坏
2020-09-24 15:49:10,慵懒的午后_Bella,我也想，但是又不敢，别人会说没那么严重，其实只有自己最了解自己
2020-09-23 23:56:48,winniepipi999,还是能力不允许，所以就算结婚了还是会隔一段时间这样做梦，经济不够独立这应该就是缺乏安全感的源头
2020-09-23 22:13:46,我想吃雪糕yo,是喜欢的男生推的
2020-09-22 13:17:59,PMC1,你是一个非常有责任感的人，我很敬佩。
2020-09-22 13:06:24,PMC1,好心疼你，所以如果要有自己的家，就要自己打造一个自己的家！
2020-09-20 15:53:09,胡公子辰,人不狠，站不稳，飞行模式
2020-09-20 13:59:53,gcq225,没关机么？
2020-09-19 23:58:19,钞吉可爱,羡慕但不会那么做，现实中我们要学会放弃伤害自己的，然后去追求更好的
2020-09-19 22:49:44,孤独自足-,希望你会遇到 或者不会讨厌这样的感觉
2020-09-19 20:29:42,酒色精气神,罗玉凤我对你不仅仅是喜欢？
2020-09-19 19:26:46,杂记_0919,今天二十岁生日，你不是一个人
2020-09-19 09:01:36,美少女战士六六,就是我的现状
2020-09-19 07:53:02,11sxz,无语
2020-09-19 01:53:19,老王同学a,有些歌听着听着就没版权了，怀疑了
2020-09-18 20:20:11,陈大和陈二的幸福生活,这样的爱情也会倒在结婚前，你们相信吗，我和我的那个她认识了10年，谈了7年，最后因为各种原因分开了
2020-09-18 19:44:15,揽星星入怀_YikT,很遗憾 接下来的日子不能继续陪你了 不出意外我们联系越来越少 关系会越来越淡直到只剩最后的回忆 当然我不想这样
2020-09-18 19:05:10,小瑞深呼吸,我好害怕别人和我在一起的时候说“好无聊哦”真的好害怕和人单独相处呀[哀伤]
2020-09-18 19:01:46,小瑞深呼吸,每次觉得很孤独的时候都想听这首歌，也可能是我内心还不够强大吧，看到大家都成群结队有很多朋友的时候，真的挺难过的…
2020-09-18 17:19:25,joka是个好少年,和初恋分手了，被我发现出轨了，她提的分手，挽不回的那种
2020-09-18 11:00:41,kurt_nirvana,马：MMP!
2020-09-18 10:52:46,KI-ELLY,对啊，告诉自己不要太坚强了，自己都不心疼自己，就不会再有人心疼你了。我也是个有血有肉的人，不是吗
2020-09-18 00:44:31,陪我去死,其实 我还是害怕一个人的
2020-09-17 23:50:24,是阿雷阿,伊人已逝[心碎][心碎]
2020-09-17 23:50:09,是阿雷阿,伊人已逝
2020-09-17 21:43:42,Ressun,每次听这首歌就想到：冒菜是一个人的火锅，火锅是一群人的冒菜[幽灵]
2020-09-17 17:32:52,姜杺诺,其实到工作中觉得还是上学开心，工作中还是摆脱不了人际关系
2020-09-17 15:36:22,uu03-,老公众号鸡汤了
2020-09-17 02:51:18,辣菜菜,有版权了啊，妈呀，网易云，牛逼了
2020-09-16 23:46:11,用户3816352526,高中时候听的歌，此时突然想起，对那句“孤单 是一个人的狂欢”有了感触。希望一个人也能活得轻松快乐！
2020-09-16 23:09:17,海豚没海_,像是一颗苦瓜味的糖，它本质是糖应该是甜的，但是苦瓜味它是苦的。这颗糖真的越尝越不好受。
2020-09-16 22:42:10,涵落唯,我希望以后就像这歌一样寂寞地生活，忘了喜欢你的委屈，努力向阳生长。
2020-09-16 16:01:41,Arya180818,会好的[多多大笑]
2020-09-16 12:19:32,流浪的笨蛤蟆,有个疼你的人爱人就有家，没有最多是有个房子
2020-09-16 08:04:22,唱给你听哇,随性一点，她们喜欢也好，不喜欢也罢，你会找到你舒服的圈子
2020-09-15 23:57:20,你永远得不到的猴哥,我一个人吃饭旅行 到处走走停停
2020-09-15 23:23:57,我与夜行,哈哈哈原来你喜欢的歌也是我喜欢的歌
2020-09-15 13:35:18,奀nn,近乎欢愉的苦楚
2020-09-15 12:56:17,别靠近太阳会被灼伤,我不应该把生活的失败归因于感情的失败。
2020-09-15 01:56:02,周六和我-,暗恋就是失恋啊
2020-09-15 01:07:22,亲亲王灏-,总要一个人，提前习惯
2020-09-15 01:07:16,亲亲王灏-,以前总喜欢热闹，却发现，热闹原来才是真的孤独
2020-09-14 22:49:30,吃瓜爱好人口,太难过了
2020-09-14 00:08:07,a阿皮啊,可能，我也是想要有个人陪的吧
2020-09-13 22:02:00,locked-away-you,我们一直相遇，也是缘分
2020-09-13 14:08:16,Ice冰语,都是自己喜欢得歌，发发牢骚而已
2020-09-13 01:23:52,肉妹在想你,宝贝开心点哦
2020-09-12 22:30:23,蒔心眼子,今天突然想起来听阿桑的歌，算是我青春记忆的一些回忆，那会儿通过网络看剧刚刚开始流行，台湾偶像剧正是比较火热的时候，几乎热播的剧都有阿桑的歌作配乐。哎呀，一晃神，青春就溜走了，阿桑，你好！
2020-09-12 22:28:38,毕竟你棒极了3,我想我不仅仅是失去你
2020-09-12 17:08:51,胡小妖的腰,活成你想的这样
2020-09-12 15:09:33,咳咳有点可爱,最近有一些感悟，透过现象看本质，其实自己真的是一个情绪管理比较差的人，对于身边人的走留特别在意，即使可能只相处了几个月，太重感情，也没有学会冷漠，在不大不小的年龄还是会做慌慌张张的事，会丧，又会满血复活，以为看开却也自我欺骗，在这个本应该发光的年纪却把自己推入黑暗。
2020-09-12 09:14:43,love-yourselves,好像
2020-09-12 08:58:23,永远好香喔,不懂 
2020-09-11 16:34:42,腥甜蜜梨,郑元畅除了演江直树我最喜欢的就是他演的葵了其他都无感
2020-09-11 10:07:47,Smile-HDY,母胎单身23年了，对爱情又憧憬又害怕，不敢去踫；相信爱情，但又感觉爱情不会降临到我身上
2020-09-11 01:25:48,dlehgdj,13号就要回学校了，现在的心情和你一样，感同身受[哀伤]
2020-09-10 21:24:12,locked-away-you,你评论好多·
2020-09-10 21:01:52,爱谁谁8989,没忘了关机吧？
2020-09-10 20:40:16,ABCtfhg,小学时每天午间广播背景音乐就是首歌，但是并没有留意。大学毕业后的某一天脑海里又飘出了隐隐约约的旋律，不完整，但是我知道很好听，就是想不起来是什么歌，没想到竟然在今天找到了。又被带回了童年………
2020-09-10 19:53:11,包包爱肥五,此时此刻，走在路上很想拨打一个熟悉的号码，聊聊日常，说说八卦，但你已不在了，每一次想到你，我都会偷偷擦眼泪。我也不知道我在想什么，只是觉得这个世界没有人真正理解和认同自己，对所有事情都失去兴趣。
2020-09-10 10:30:48,Ice冰语,叶子离开树就变成无依无靠的翅膀飘向何方只有风知道
2020-09-10 08:38:43,龙小七丶,想在网易云处个女闺蜜，谈出感情我负责
2020-09-10 02:52:51,人间沼泽13,Do you miss me?
2020-09-10 01:27:21,老王在我有何怕,我想买身新衣服、走的洒脱点
2020-09-10 00:43:09,_肥文剂,好经典
2020-09-10 00:25:06,-白鹿吴小胖,当他一次次给我设立人设，说自己有感情洁癖，希望彼此坦诚相待，不接受背叛。然而，偏偏是他没有做到这一切？为什么要设立这些人设呢？我想不通，我也无法接受分开的事实……单曲循环一个晚上，还是想不通。
2020-09-09 23:37:13,高冷男神君陌陌,快到点了就抑一下吧，反正你也很久没有快乐了
2020-09-09 23:29:13,李倦容,无论如何，爱永远没有错的～再来一千次，一万次，爱就是爱。
2020-09-09 16:47:10,宁爱范志敏,我很坚强，我还活着。我会好好的活着，即使身旁已没有了你。我也不会再想起你。
2020-09-09 09:29:03,雪中观鹤,我现在就是哎
2020-09-09 08:13:30,糯米粽子_呀,高中开始，一起六年还是分开了
2020-09-08 15:46:10,小小小可爱人儿,我们从高中在一起，七年长跑，快要结婚了[爱心]
2020-09-08 14:53:34,徐志摩小迷弟,阿桑唱歌 总是特别的有感情
2020-09-08 01:01:22,咳咳有点可爱,既然做了决定，那就坚定一点，听见没，给我长点心，难道你想一次又一次掉进shi里出不来么？
2020-09-07 21:43:24,暴走萝莉Kim,残忍
2020-09-07 19:14:31,人的一生究竟有多长,善良，懂事，也会累，也会想要被人照顾
2020-09-06 22:50:06,atWish,呀 这首歌瞬间把我带到有威廉的那些日子👐🏻👩🏻‍🦰
2020-09-06 17:46:41,悼夏,既已决定孤独就不要轻易激动
2020-09-05 15:28:45,窗户里的松毛虫,正在宿舍看书写信突然想到这首歌，点进来看到你
2020-09-05 01:23:03,温柔与我共ovo,我是真的很喜欢他呀 可也是真的错过了 再也回不来了
2020-09-05 00:47:15,庄伊玉,！一定
2020-09-04 22:01:15,荏苒荏性,请你一而再再而三地选择我
2020-09-04 21:34:15,UAENAZD,所以我决定我绝对不会让这个爱我的女人受委屈
2020-09-04 17:26:02,killmehealme8,他回武汉了
2020-09-03 17:39:24,啊宇叔叔-,后来那个人告诉我 吃饭能死桌子上 洗澡能洗一天 睡觉还能发动态 沉默就是拒绝 晚安就是懒得搭理你
2020-09-03 14:25:49,男人肾好用肾宝,巧了 我正是
2020-09-03 12:33:53,__三葉__,我想我不仅仅是失去你，还有曾经为了你奋不顾身的自己吧
2020-09-03 12:25:40,辰辰-bxb,岁月很长人海茫茫，你别回头也别将就。
2020-09-03 12:25:36,辰辰-bxb,好听
2020-09-02 18:37:00,肖优秀w,好想家啊哈哈哈哈哈
2020-09-02 07:38:59,ljl先生,有才华的人这么早离开我们，你的声音永远被铭记！
2020-09-01 22:21:41,不要死脸yu,要勇敢啊
2020-09-01 21:15:45,不耐烦的zzlin,哈哈哈
2020-09-01 13:12:17,矢懐_,拥有前先接受失去[可爱]
2020-09-01 01:51:20,侧脸可爱多,每一个渣男心里都藏了一个曾经错过的她
2020-08-31 20:58:51,挽世事,我可以不要细节 但你能给我安全感吗。
2020-08-31 13:29:20,黑糖芋泥鲜乳,我也想去看心理医生了，今年越来越严重了
2020-08-31 11:13:16,你猜猜向日葵的花语呀,我想我不仅仅是失去你
2020-08-30 11:21:58,草丛小熊猫,第一次听这首歌，是在大学的教室，一天晚上，几百人的大课，不考试那种，老师在最后几分钟，说给你们放个flash，就是这首歌。我永远忘不了那个夜，还有和我一起听歌的人。可我把她弄丢了
2020-08-29 15:55:54,枣仁,我想我永远都会记得我遇见这么一个有趣的人
2020-08-29 01:40:09,美丽人生beautifullifelife,单身感觉真好，不用依赖别人，慢慢磨练自己的意志，也感觉细心耐心。感谢那些伤害过我的人，曾经以为自己走不出来现在已经不在乎了，就算现在有人跪我面前求婚，我也无动于衷了。
2020-08-29 00:10:09,不过一束尘埃之光,阿桑，你唱的歌，都像是在说我[流泪][流泪][流泪]我觉得我自己好可怜，我爸爸在我没有准备的情况下就在我面前离开我了，我爱的男生不爱我了，不要我了。我现在都不知道我活着的意义在哪儿
2020-08-28 21:00:26,珊瑚小草,回味。。。。
2020-08-28 06:07:29,绾绾曦子,这首歌是丢了对方，也丢了自己啊。
2020-08-28 00:20:05,那你快跑啊,心又飘到哪里就连自己也看不清
2020-08-27 22:36:47,常笑qq,我也以为我会成为你羡慕的样子，但是最后我发现事与愿违
2020-08-27 22:25:49,常笑qq,我其实没你想的那么不好，以前只是我太小，心智不成熟，你也没我想的那么好，而是我把你美化了
2020-08-27 20:41:07,sqks_,我讨厌那些每天跟我讲学习没有用，学习好也找不到好工作没有用，自己不努力高中都考不上的人你别老把你的负面情绪往我头上扣，我学习关你屁事🙃
2020-08-27 12:38:19,润稣,又成熟稳重，又精致漂亮的，哪有那么好的事，大都是故事
2020-08-27 10:08:17,RR围绕,原来这句话出自这里
2020-08-27 08:54:24,最好的猎手往往以猎物的方式出现,我记得当时看深夜食堂里徐娇唱的这首歌，很好听
2020-08-27 05:13:31,xwy231200,陪一个男孩长大真的好难
2020-08-27 01:30:02,後知Y後覺,我错了，我真的错了，我把心弄丢了，你可不可以把心还给我♡
2020-08-27 01:00:19,落夕yang,是不是没有根，所以依旧漂泊无依。
2020-08-27 00:54:54,Oudmatch,祝你睡个好觉吧
2020-08-26 20:29:47,Law-生,其实我有点怕听阿桑的歌，感觉内心有点悲，怕自己越来越悲
2020-08-26 20:02:01,老氿氿,其实  我比你更早意识到我们不合适  但是我舍不得
2020-08-26 17:55:01,苜堇_,真的很谢谢你，现在我的心情无法用语言去形容。(虽然我是准高一[多多大笑])很多时候感觉有些事情都能一眼看到头，这长长的一生对我来说也没什么意义，对热爱的一切提不起兴趣。正如你所说，可能当下转换方向，努力提升自己才是正确的。也希望你一切顺利，一起加油
2020-08-26 09:03:28,嘟噜噜噜噜嗯,最怕陌生人突然的关心，然后最后的假装也全盘崩溃
2020-08-26 03:31:19,你在我心里又何止好几年_,大半夜的又给我听哭了
2020-08-25 22:41:22,非臆想,罢，善良长存，与君共勉。
2020-08-25 22:40:54,非臆想,的书籍，这可以使你变得有思想而有力量，从而不会被轻易打败，在情感方面，我唐突的建议你莫要过早开始一段感情，等到考上好大学了再做选择也不迟，那时才不会被冲动给误导，相信阳光吧，朋友，正如同巴金所说的那样，春天是我们的 ，且趁春天之火还旺，向前走吧，望你能找到一条属于自己的路，赤子也
2020-08-25 22:35:54,非臆想,的环境，万不可一边苦叹生活不顺，一边却又不愿改变，对于我们而言，时间是最珍贵的东西，切莫在失去后才后悔，唯有向前走才能有新的出路，珍惜你身边能同你说上话的朋友，不必羡慕那些朋友看起来极广的人，毕竟朋友本就不是用来炫耀的，真正关心你的人才是最重要的，如果在学校依旧感到孤独，读读向上
2020-08-25 22:29:34,非臆想,陌生人，我也是一位准高二的学生，对于内向的人而言，融入了一个新的环境诚然是辛酸的，我当初也如同你这般，后来在经过无数次痛苦的反思后，我自己总结出了一个不是道理的道理，在迷茫之时，唯有放下其他虚无的臆想，专心读书，因为环境对一个人而言真的很重要，书读好了，才有机会和能力去选择你想要
2020-08-25 20:58:35,瑞哥哥的世界很大,后来我发现意难平的不是我曾经有多喜欢你，而是你走后留给我的阴影…
2020-08-25 19:48:15,周杰伦的女人绝不认输啊,我一个狗骑车旅行到处走走停停[狗]
2020-08-25 17:47:56,过气作者-,是这种最好了
2020-08-25 15:48:19,KangLei0823,今天特意来听下😂
2020-08-25 11:34:14,托马斯污妖王,原来这句话是这首歌的歌词呀
2020-08-25 01:40:57,再见卡滋,2020年8月25号七夕节 秉持着19年的态度继续循环🔄 并不觉得自己惨 路上人太多 必须跟自己携手努力进步的人在一起～
2020-08-24 15:43:14,黑化霉霉超疯,别让叶子这么惨了[多多捂脸]
2020-08-24 15:36:57,爱皱眉头的拿铁铁,最让人心安的  其实是孤独
2020-08-24 10:18:03,又生又生,我想我只是更爱我自己
2020-08-23 21:15:25,San-0517,醒醒，天亮了
2020-08-23 15:37:19,叫我周准时-,你要允许有一些人 有安静的青春一直向往校园恋爱 最后是一直到结婚那种但是向往终究只是向往
2020-08-23 12:02:53,一只草鹿,？？？？？？？是有多受伤
2020-08-23 09:57:29,wobuzhidaoqushenmemingzi,我已知身边有四对从高中到大学，现已结婚，可能未来有五对六对，祝福他们！
2020-08-23 04:48:22,devil0572,但能幼稚地喜欢一个人或许也是一件美事吧
2020-08-23 03:40:06,糜生_Henry,静静的听歌
2020-08-23 03:16:57,better_me_zyf,天妒英才，地好庸人。
2020-08-23 03:16:31,better_me_zyf,天妒英才，地好庸才。
2020-08-22 22:01:23,旺旺是ge仙贝,"""我越安静 我越平和 我越淡定 我越忍耐 我越无所谓 我眼里暗藏的汹涌就越沸腾"""
2020-08-22 21:27:08,苜堇_,我的“爱情”，说来可笑大概可能算是我自己葬送的了吧。不知道他对我是何种感情，但自从我说我有喜欢的男生后，我俩就渐行渐远了，他也不再找我，今天是他提前批考试，我也不知道他考得到底怎么样，我们能不能在一个高中。在一个高中又怎样呢？这样的情况下，友情还是爱情都很尴尬不是吗
2020-08-22 21:25:43,苜堇_,友情方面，能说话的朋友只有一个，她很好，但我这个人将近六年的被孤立经历，让我很孤僻，不喜欢时时刻刻和人交流，特别讨厌和陌生人交流，或者出门到一个陌生的环境，有许多人，比如超市，真的让我难受又窒息
